{
  "schema": "thought-vibration.session/v1",
  "session_id": "stereo-5p5-reference",
  "mode": "acoustic-engineering",
  "claim_domain": "SYMBOLIC",
  "source_id": "mythiences.audio.cinematic/reference-stereo-1",
  "render_intent_confirmed": true,
  "audio": {
    "kind": "separate-ear-stereo",
    "duration_seconds": 2,
    "sample_rate_hz": 48000,
    "gain_linear": 0.08,
    "fade_seconds": 0.02,
    "left_hz": 432,
    "right_hz": 437.5,
    "phase_offset_deg": 0
  },
  "output": {"kind": "offline-diagnostic-wav", "playback": false},
  "mythic": {"channel_state": "open", "rhythm_pattern": "Tesla resonance tune | authorial cue", "interpretation": "3/6/9 phrase: a pair of voices negotiating distinct spaces"},
  "stop_point": "Inspect channel-separated spectra before delivery",
  "next_owner": "Wayglass-Mobius-Engineer",
  "unresolved_questions": ["Does the intended endpoint maintain channel separation?"]
}
